Assumption_ID,Section,Area,Category,Statement_Summary,Risk_If_Invalid,Default_Included,Customer_Action_Required,Version,Status
AMS-EXC-007,100,Exclusions,Exclusion,Network / hardware / browser / VPN / printer / IT infrastructure support excluded; Oracle SaaS infrastructure is Oracle's; APPSolve AMS = application config layer only,Client routes IT infrastructure tickets to APPSolve AMS,Yes,Acknowledge infrastructure exclusion,1.0,Active
AMS-EXC-008,100,Exclusions,Exclusion,New Acumatica customisation development (low-code extensions / workflow customisations / custom web services / custom report designer) excluded from standard Acumatica AMS,Client expects new Acumatica customisations delivered under AMS,Yes,Acknowledge customisation development exclusion,1.0,Active
AMS-EXC-009,100,Exclusions,Exclusion,Major version upgrades (Oracle EBS / Acumatica / BeBanking platform) excluded from standard AMS; project-level activities requiring separate planning and delivery engagement,Client expects major upgrades managed under standard AMS,Yes,Acknowledge upgrade exclusion,1.0,Active
AMS-EXC-010,100,Exclusions,Exclusion,Oracle licensing and subscription management excluded from AMS; APPSolve advises on licensing implications; does not purchase/renew/modify Oracle licences on client's behalf,Client expects APPSolve to manage Oracle licence renewals under AMS,Yes,Acknowledge Oracle licence management exclusion,1.0,Active
AMS-EXC-011,100,Exclusions,Exclusion,Oracle Analytics Cloud (OAX/FAW) dashboard and data model development excluded from AMS; OAX development is separately scoped project work,Client expects OAX report development under standard AMS price,Yes,Acknowledge OAX development exclusion,1.0,Active
AMS-EXC-012,100,Exclusions,Exclusion,Disaster recovery testing excluded from AMS; Oracle SaaS DR is Oracle's responsibility; on-premises DR is client IT team's responsibility,Client expects APPSolve to manage DR testing for Oracle ERP under AMS,Yes,Acknowledge DR testing exclusion,1.0,Active
